{
  "schema_version": "fem.ac_eqs-input.v1",
  "analysis": "ac_eqs",
  "units": "SI",
  "geometry": {
    "body_length_m": 0.0012,
    "active_gap_count": 6,
    "dielectric_gap_m": 5e-06,
    "electrode_thickness_m": 2e-06,
    "electrode_overlap_m": 0.0008,
    "left_margin_m": 0.0002,
    "right_margin_m": 0.0002,
    "top_cover_m": 1e-05,
    "bottom_cover_m": 1e-05
  },
  "out_of_plane_thickness_m": 0.001,
  "mesh": {
    "target_size_m": 5e-06
  },
  "source_reference": "Synthetic experiment qualification geometry; not a calibrated device",
  "thermal": {
    "enabled": true,
    "ceramic_k_W_per_m_K": 3.0,
    "Ni_k_W_per_m_K": 90.0,
    "ambient_K": 300.0,
    "boundary_kind": "dirichlet",
    "convection_h_W_per_m2_K": 0.0,
    "source_reference": "Synthetic experiment thermal coefficients and end cooling; not an installation calibration"
  },
  "outputs": {
    "field_data": true,
    "field_images": true
  },
  "frequency_Hz": 100000.0,
  "voltage_convention": "rms",
  "potentials": {
    "terminal_a_real_V": 10.0,
    "terminal_a_imag_V": 0.0,
    "terminal_b_real_V": 0.0,
    "terminal_b_imag_V": 0.0
  },
  "materials": {
    "ceramic_lower": {
      "eps_r": 1500.0,
      "sigma_S_m": 0.0001,
      "tan_delta": 0.01,
      "source_reference": "Synthetic passive linear experiment parameter; validity not_checked"
    },
    "ceramic_upper": {
      "eps_r": 1500.0,
      "sigma_S_m": 0.0001,
      "tan_delta": 0.01,
      "source_reference": "Synthetic passive linear experiment parameter; validity not_checked"
    }
  },
  "dielectric_layout": "uniform"
}
